{
  "comment": "Summary. The paper's main claim is that We evaluate a compact classifier on two public datasets. It further reports that The method adds a calibrated linear head to a frozen encoder. The assessment stays within extracted claims and cited evidence rather than inferring external novelty or unreported results.\n\nStrengths. A concrete strength is that the main assertion is specific enough to inspect: We evaluate a compact classifier on two public datasets. The paper identifies page 1, section Abstract, p1-b2-l0, improving traceability between its assertion and reported support.\n\nConcern 1 (minority-supported; major severity; page 2, p2-b4-l0): The paper explicitly states a evaluation scope limitation. The cited passage reports that The study covers classification and two datasets only. This has direct impact on the target claim and high decision relevance. Recommended author check: Address the documented evaluation scope limitation with targeted evidence.\n\nScore calibration. Retained evidence leads to soundness 2/4, presentation 3/4, significance 2/4, originality 3/4, and an overall recommendation of 2/6. Confidence is 4/5 and denotes certainty in this assessment, not paper quality. The deterministic score-comment consistency guards passed; the recommendation uses retained evidence rather than averaged reviewer scores.\n\nScope and next step. This comment does not infer novelty against unchecked external literature or treat missing extraction as adverse evidence. Address the numbered checks with precise page-local support; if support is unavailable, state that limitation so confidence and the recommendation can be recalibrated against the same official anchors. Revisit the result if an author response or fuller extraction changes the paper-local evidence available for assessment.",
  "confidence": 4,
  "originality": 3,
  "overall_recommendation": 2,
  "paper_id": "SAMPLE-006",
  "presentation": 3,
  "significance": 2,
  "soundness": 2
}
